{"$schema":"https://json-schema.org/draft/2020-12/schema","$id":"https://legal-content.codepackr.com/schemas/collection.schema.json","title":"Legal Collection","type":"object","required":["schemaVersion","entityType","id","version","status","title","jurisdiction","content","sources","updatedAt"],"properties":{"schemaVersion":{"type":"string"},"entityType":{"const":"collection"},"id":{"type":"string"},"version":{"type":"integer","minimum":1},"status":{"type":"string"},"title":{"type":"string"},"jurisdiction":{"type":"string"},"content":{"type":"object","required":["members"],"properties":{"description":{"type":"string"},"members":{"type":"array","items":{"type":"string"}}},"additionalProperties":true},"sources":{"type":"array","items":{"type":"string"}},"updatedAt":{"type":"string","format":"date-time"}},"additionalProperties":false}