{
  "schemaVersion": "v1",
  "entityType": "collection",
  "id": "collection:india:sra-complete",
  "version": 1,
  "status": "published",
  "title": "Specific Relief Act, 1963 — Working set",
  "jurisdiction": "India",
  "content": {
    "description": "Specific performance, substituted performance, declaration and injunction.",
    "members": ["topic:india:sra-s-10", "topic:india:sra-s-14", "topic:india:sra-s-16", "topic:india:sra-s-20", "topic:india:sra-s-34", "topic:india:sra-s-38"]
  },
  "sources": ["source:india:india-code-sra-1963"],
  "updatedAt": "2026-09-30T23:05:00Z"
}
