{
  "schemaVersion": "v1",
  "entityType": "collection",
  "id": "collection:india:ni-complete",
  "version": 1,
  "status": "published",
  "title": "Negotiable Instruments Act, 1881 — Working set",
  "jurisdiction": "India",
  "content": {
    "description": "Cheque dishonour offence, presumption of liability, offences by companies, and cognizance of offences under Chapter XVII.",
    "members": ["topic:india:ni-s-138", "topic:india:ni-s-139", "topic:india:ni-s-141", "topic:india:ni-s-142"]
  },
  "sources": ["source:india:india-code-ni-1881"],
  "updatedAt": "2026-09-30T18:30:00Z"
}
